Sheet: RateSheet
A1: Rates Table for Policy Renewals | S1: 1
S2: 2
A3: Coverage Type | S3: 3
Q4: Dental | R4: False | S4: 4
B5: Medical: | C5: INCLUDED | E5: Dental Coverage: | F5: =IF(R[-1]C[12]="True","INCLUDED","EXCLUDED") -> EXCLUDED | H5: Prescription Plan: | I5: =IF(RC[9]="True","INCLUDED","EXCLUDED") -> INCLUDED | Q5: Pharmaceutical | R5: True | S5: 5
S6: 6
S7: 7
A8: Policy Type | S8: 8
S9: 9
B10: Plan Type | C10: PPO | E10: Period | F10: Annual | H10: Company Size | I10: 1-9 | S10: 10
S11: 11
S12: 12
A13: Options & Limits | S13: 13
S14: 14
B15: Deductible | C15: $500 | E15: Out of Pocket Limit | F15: $2,500 | H15: Lifetime Limit | I15: $1,000,000 | S15: 15
S16: 16
C21: Rates | D21: Monthly | F21: Semi-Annual | H21: Annual
C22: Individual | D22: 54.5 | F22: =RC4*6 -> 327 | H22: =RC4*12 -> 654
C24: Individual & Spouse | D24: 105.75 | F24: =RC4*6 -> 634.5 | H24: =RC4*12 -> 1269
C26: Individual & One Dependent | D26: 112 | F26: =RC4*6 -> 672 | H26: =RC4*12 -> 1344
C28: Individual & Family | D28: 152.25 | F28: =RC4*6 -> 913.5 | H28: =RC4*12 -> 1827