Sheet: Sheet1
A1: name3/4's virtual base | E1: name4 | G1: name3
E2: =name4 -> 3 | G2: =name3 -> 1
B3: 23 | G3: =(RC2 * 655+Sheet2!R[-1]C[-5]-R[1]C[2]) -> 15063 | I3: 232
A4: name2-> | B4: 65 | C4: 2342 | D4: 32.898000000000003 | E4: hidden formula---> | G4: =AVERAGE(RC[-5]:RC[-3]) -> 813.29933333333338 | I4: 234
B5: 35 | F5: +name1-> | G5: =SUM(R[-2]C[-5],R[-1]C[-5],R[-1]C[-3],name1) -> 463.89800000000002 | I5: 2342
F6: +name2-> | G6: =SUM(R[-3]C[-5],R[-2]C[-5],R[-2]C[-3],name2) -> 185.898
B8: Protected Sheet

Sheet: Sheet2
B2: 232
A4: name1-> | B4: 343