Sheet: Quick Tour
A1: Quick Tour of Microsoft Excel Solver
A2: Month | B2: Q1 | C2: Q2 | D2: Q3 | E2: Q4 | F2: Total
A3: Seasonality | B3: 0.9 | C3: 1.1 | D3: 0.8 | E3: 1.2
A5: Units Sold | B5: =35*R[-2]C*(R[6]C+3000)^0.5 -> 3591.5525890622844 | C5: =35*R[-2]C*(R[6]C+3000)^0.5 -> 4389.6753866316812 | D5: =35*R[-2]C*(R[6]C+3000)^0.5 -> 3192.4911902775862 | E5: =35*R[-2]C*(R[6]C+3000)^0.5 -> 4788.7367854163795 | F5: =SUM(RC[-4]:RC[-1]) -> 15962.455951387932
A6: Sales Revenue | B6: =R[-1]C*R18C2 -> 143662.10356249136 | C6: =R[-1]C*R18C2 -> 175587.01546526724 | D6: =R[-1]C*R18C2 -> 127699.64761110344 | E6: =R[-1]C*R18C2 -> 191549.47141665517 | F6: =SUM(RC[-4]:RC[-1]) -> 638498.2380555172 | H6: Color Coding
A7: Cost of Sales | B7: =R[-2]C*R19C2 -> 89788.8147265571 | C7: =R[-2]C*R19C2 -> 109741.88466579204 | D7: =R[-2]C*R19C2 -> 79812.27975693965 | E7: =R[-2]C*R19C2 -> 119718.41963540949 | F7: =SUM(RC[-4]:RC[-1]) -> 399061.39878469828
A8: Gross Margin | B8: =R[-2]C-R[-1]C -> 53873.288835934261 | C8: =R[-2]C-R[-1]C -> 65845.1307994752 | D8: =R[-2]C-R[-1]C -> 47887.367854163793 | E8: =R[-2]C-R[-1]C -> 71831.051781245682 | F8: =SUM(RC[-4]:RC[-1]) -> 239436.83927081892 | J8: Target cell
A10: Salesforce | B10: 8000 | C10: 8000 | D10: 9000 | E10: 9000 | F10: =SUM(RC[-4]:RC[-1]) -> 34000 | J10: Changing cells
A11: Advertising | B11: =10000 -> 10000 | C11: =10000 -> 10000 | D11: =10000 -> 10000 | E11: =10000 -> 10000 | F11: =SUM(RC[-4]:RC[-1]) -> 40000
A12: Corp Overhead | B12: =0.15*R[-6]C -> 21549.315534373705 | C12: =0.15*R[-6]C -> 26338.052319790084 | D12: =0.15*R[-6]C -> 19154.947141665514 | E12: =0.15*R[-6]C -> 28732.420712498275 | F12: =SUM(RC[-4]:RC[-1]) -> 95774.735708327586 | J12: Constraints
A13: Total Costs | B13: =SUM(R[-3]C:R[-1]C) -> 39549.3155343737 | C13: =SUM(R[-3]C:R[-1]C) -> 44338.052319790084 | D13: =SUM(R[-3]C:R[-1]C) -> 38154.947141665514 | E13: =SUM(R[-3]C:R[-1]C) -> 47732.420712498279 | F13: =SUM(RC[-4]:RC[-1]) -> 169774.73570832756
A15: Prod. Profit | B15: =R[-7]C-R[-2]C -> 14323.97330156056 | C15: =R[-7]C-R[-2]C -> 21507.078479685115 | D15: =R[-7]C-R[-2]C -> 9732.4207124982786 | E15: =R[-7]C-R[-2]C -> 24098.631068747403 | F15: =SUM(RC[-4]:RC[-1]) -> 69662.103562491364
A16: Profit Margin | B16: =R[-1]C/R[-10]C -> 9.9705997241852973E-2 | C16: =R[-1]C/R[-10]C -> 0.12248672501606143 | D16: =R[-1]C/R[-10]C -> 7.6213371724700413E-2 | E16: =R[-1]C/R[-10]C -> 0.12580891448313355 | F16: =R[-1]C/R[-10]C -> 0.10910304744871398
A18: Product Price | B18: 40
A19: Product Cost | B19: 25
A21: The following examples show you how to work with the model above to solve for one value or several
A22: values to maximize or minimize another value, enter and change constraints, and save a problem model.
A24: Row | B24: Contains | D24: Explanation
A25: 3 | B25: Fixed values | D25: Seasonality factor: sales are higher in quarters 2 and 4,
D26: and lower in quarters 1 and 3.
A28: 5 | B28: =35*B3*(B11+3000)^0.5 | D28: Forecast for units sold each quarter: row 3 contains
D29: the seasonality factor; row 11 contains the cost of
D30: advertising.
A32: 6 | B32: =B5*$B$18 | D32: Sales revenue: forecast for units sold (row 5) times
D33: price (cell B18).
A35: 7 | B35: =B5*$B$19 | D35: Cost of sales: forecast for units sold (row 5) times
D36: product cost (cell B19).
A38: 8 | B38: =B6-B7 | D38: Gross margin: sales revenues (row 6) minus cost of
D39: sales (row 7).
A41: 10 | B41: Fixed values | D41: Sales personnel expenses.
A43: 11 | B43: Fixed values | D43: Advertising budget (about 6.3% of sales).
A45: 12 | B45: =0.15*B6 | D45: Corporate overhead expenses: sales revenues (row 6)
D46: times 15%.
A48: 13 | B48: =SUM(B10:B12) | D48: Total costs: sales personnel expenses (row 10) plus
D49: advertising (row 11) plus overhead (row 12).
A51: 15 | B51: =B8-B13 | D51: Product profit: gross margin (row 8) minus total costs
D52: (row 13).
A54: 16 | B54: =B15/B6 | D54: Profit margin: profit (row 15) divided by sales revenue
D55: (row 6).
A57: 18 | B57: Fixed values | D57: Product price.
A59: 19 | B59: Fixed values | D59: Product cost.
A61: This is a typical marketing model that shows sales rising from a base figure (perhaps due to the sales
A62: personnel) along with increases in advertising, but with diminishing returns. For example, the first
A63: $5,000 of advertising in Q1 yields about 1,092 incremental units sold, but the next $5,000 yields only
A64: about 775 units more.
A66: You can use Solver to find out whether the advertising budget is too low, and whether advertising
A67: should be allocated differently over time to take advantage of the changing seasonality factor.
A69: Solving for a Value to Maximize Another Value
A70: One way you can use Solver is to determine the maximum value of a cell by changing another cell. The
A71: two cells must be related through the formulas on the worksheet. If they are not, changing the value in
A72: one cell will not change the value in the other cell.
A74: For example, in the sample worksheet, you want to know how much you need to spend on advertising
A75: to generate the maximum profit for the first quarter. You are interested in maximizing profit by changing
A76: advertising expenditures.
A78: n | B78: On the Tools menu, click Solver. In the Set target cell box, type b15 or
B79: select cell B15 (first-quarter profits) on the worksheet. Select the Max option.
B80: In the By changing cells box, type b11 or select cell B11 (first-quarter advertising)
B81: on the worksheet. Click Solve.
A83: You will see messages in the status bar as the problem is set up and Solver starts working. After a
A84: moment, you'll see a message that Solver has found a solution. Solver finds that Q1 advertising of
A85: $17,093 yields the maximum profit $15,093.
A87: n | B87: After you examine the results, select Restore original values and click OK to
B88: discard the results and return cell B11 to its former value.
A90: Resetting the Solver Options
A92: If you want to return the options in the Solver Parameters dialog box to their original settings so that
A93: you can start a new problem, you can click Reset All.
A95: Solving for a Value by Changing Several Values
A97: You can also use Solver to solve for several values at once to maximize or minimize another value. For
A98: example, you can solve for the advertising budget for each quarter that will result in the best profits for
A99: the entire year. Because the seasonality factor in row 3 enters into the calculation of unit sales in row 5
A100: as a multiplier, it seems logical that you should spend more of your advertising budget in Q4 when the
A101: sales response is highest, and less in Q3 when the sales response is lowest. Use Solver to determine
A102: the best quarterly allocation.
A104: n | B104: On the Tools menu, click Solver. In the Set target cell box, type f15 or select
B105: cell F15 (total profits for the year) on the worksheet. Make sure the Max option is
B106: selected. In the By changing cells box, type b11:e11 or select cells B11:E11
B107: (the advertising budget for each of the four quarters) on the worksheet. Click Solve.
A109: n | B109: After you examine the results, click Restore original values and click OK to
B110: discard the results and return all cells to their former values.
A112: You've just asked Solver to solve a moderately complex nonlinear optimization problem; that is, to find
A113: values for the four unknowns in cells B11 through E11 that will maximize profits. (This is a nonlinear
A114: problem because of the exponentiation that occurs in the formulas in row 5). The results of this
A115: unconstrained optimization show that you can increase profits for the year to $79,706 if you spend
A116: $89,706 in advertising for the full year.
A118: However, most realistic modeling problems have limiting factors that you will want to apply to certain
A119: values. These constraints may be applied to the target cell, the changing cells, or any other value that
A120: is related to the formulas in these cells.
A122: Adding a Constraint
A124: So far, the budget recovers the advertising cost and generates additional profit, but you're reaching a
A125: point of diminishing returns. Because you can never be sure that your model of sales response to
A126: advertising will be valid next year (especially at greatly increased spending levels), it doesn't seem
A127: prudent to allow unrestricted spending on advertising.
A129: Suppose you want to maintain your original advertising budget of $40,000. Add the constraint to the
A130: problem that limits the sum of advertising during the four quarters to $40,000.
A132: n | B132: On the Tools menu, click Solver, and then click Add. The Add Constraint
B133: dialog box appears. In the Cell reference box, type f11 or select cell F11
B134: (advertising total) on the worksheet. Cell F11 must be less than or equal to $40,000.
B135: The relationship in the Constraint box is <= (less than or equal to) by default, so
B136: you don't have to change it. In the box next to the relationship, type 40000. Click
B137: OK, and then click Solve.
A139: n | B139: After you examine the results, click Restore original values and then click OK
B140: to discard the results and return the cells to their former values.
A142: The solution found by Solver allocates amounts ranging from $5,117 in Q3 to $15,263 in Q4. Total
A143: Profit has increased from $69,662 in the original budget to $71,447, without any increase in the
A144: advertising budget.
A146: Changing a Constraint
A148: When you use Microsoft Excel Solver, you can experiment with slightly different parameters to decide
A149: the best solution to a problem. For example, you can change a constraint to see whether the results
A150: are better or worse than before. In the sample worksheet, try changing the constraint on advertising
A151: dollars to $50,000 to see what that does to total profits.
A153: n | B153: On the Tools menu, click Solver. The constraint, $F$11<=40000, should
B154: already be selected in the Subject to the constraints box. Click Change. In
B155: the Constraint box, change 40000 to 50000. Click OK, and then click Solve.
B156: Click Keep solver solution and then click OK to keep the results that are
B157: displayed on the worksheet.
A159: Solver finds an optimal solution that yields a total profit of $74,817. That's an improvement of $3,370
A160: over the last figure of $71,447. In most firms, it's not too difficult to justify an incremental investment of
A161: $10,000 that yields an additional $3,370 in profit, or a 33.7% return on investment. This solution also
A162: results in profits of $4,889 less than the unconstrained result, but you spend $39,706 less to get there.
A164: Saving a Problem Model
A166: When you click Save on the File menu, the last selections you made in the Solver Parameters
A167: dialog box are attached to the worksheet and retained when you save the workbook. However, you
A168: can define more than one problem for a worksheet by saving them individually using Save Model in
A169: the Solver Options dialog box. Each problem model consists of cells and constraints that you
A170: entered in the Solver Parameters dialog box.
A172: When you click Save Model, the Save Model dialog box appears with a default selection, based
A173: on the active cell, as the area for saving the model. The suggested range includes a cell for each
A174: constraint plus three additional cells. Make sure that this cell range is an empty range on the
A175: worksheet.
A177: n | B177: On the Tools menu, click Solver, and then click Options. Click Save Model.
B178: In the Select model area box, type h15:h18 or select cells H15:H18 on the
B179: worksheet. Click OK.
A181: Note You can also enter a reference to a single cell in the Select model area box. Solver will use
A182: this reference as the upper-left corner of the range into which it will copy the problem specifications.
A185: To load these problem specifications later, click Load Model on the Solver Options dialog box,
A186: type h15:h18 in the Model area box or select cells H15:H18 on the sample worksheet, and then
A187: click OK. Solver displays a message asking if you want to reset the current Solver option settings with
A188: the settings for the model you are loading. Click OK to proceed.

Sheet: Product Mix
A1: Example 1: Product mix problem with diminishing profit margin.
A2: Your company manufactures TVs, stereos and speakers, using a common parts inventory | I2: Color Coding
A3: of power supplies, speaker cones, etc. Parts are in limited supply and you must determine
A4: the most profitable mix of products to build. But your profit per unit built decreases with | K4: Target cell
A5: volume because extra price incentives are needed to load the distribution channel.
K6: Changing cells
D8: TV set | E8: Stereo | F8: Speaker | K8: Constraints
C9: Number to Build-> | D9: 100 | E9: 100 | F9: 100
A10: Part Name | B10: Inventory | C10: No. Used
A11: Chassis | B11: 450 | C11: =R9C4*RC[1]+R9C5*RC[2]+R9C6*RC[3] -> 200 | D11: 1 | E11: 1 | F11: 0
A12: Picture Tube | B12: 250 | C12: =R9C4*RC[1]+R9C5*RC[2]+R9C6*RC[3] -> 100 | D12: 1 | E12: 0 | F12: 0 | H12: Diminishing
A13: Speaker Cone | B13: 800 | C13: =R9C4*RC[1]+R9C5*RC[2]+R9C6*RC[3] -> 500 | D13: 2 | E13: 2 | F13: 1 | H13: Returns
A14: Power Supply | B14: 450 | C14: =R9C4*RC[1]+R9C5*RC[2]+R9C6*RC[3] -> 200 | D14: 1 | E14: 1 | F14: 0 | H14: Exponent:
A15: Electronics | B15: 600 | C15: =R9C4*RC[1]+R9C5*RC[2]+R9C6*RC[3] -> 400 | D15: 2 | E15: 1 | F15: 1 | H15: 0.9
D16: Profits:
C17: By Product | D17: =75*MAX(R[-8]C,0)^R15C8 -> 4732.1800836014527 | E17: =50*MAX(R[-8]C,0)^R15C8 -> 3154.7867224009683 | F17: =35*MAX(R[-8]C,0)^R15C8 -> 2208.3507056806779
C18: Total | D18: =SUM(R[-1]C:R[-1]C[2]) -> 10095.317511683099
A20: This model provides data for several products using common parts, each with a different profit margin
A21: per unit. Parts are limited, so your problem is to determine the number of each product to build from the
A22: inventory on hand in order to maximize profits.
A24: Problem Specifications
A26: Target Cell | C26: D18 | E26: Goal is to maximize profit.
A28: Changing cells | C28: D9:F9 | E28: Units of each product to build.
A30: Constraints | C30: C11:C15<=B11:B15 | E30: Number of parts used must be less than or
E31: equal to the number of parts in inventory.
C33: D9:F9>=0 | E33: Number to build value must be greater than or
E34: equal to 0.
A36: The formulas for profit per product in cells D17:F17 include the factor ^H15 to show that profit per unit
A37: diminishes with volume. H15 contains 0.9, which makes the problem nonlinear. If you change H15 to
A38: 1.0 to indicate that profit per unit remains constant with volume, and then click Solve again, the
A39: optimal solution will change. This change also makes the problem linear.

Sheet: Shipping Routes
A1: Example 2: Transportation Problem.
A2: Minimize the costs of shipping goods from production plants to warehouses near metropolitan demand
A3: centers, while not exceeding the supply available from each plant and meeting the demand from each
A4: metropolitan area.
C6: Number to ship from plant x to warehouse y (at intersection): | J6: Color Coding
A7: Plants: | B7: Total | C7: San Fran | D7: Denver | E7: Chicago | F7: Dallas | G7: New York
A8: S. Carolina | B8: =SUM(RC[1]:RC[5]) -> 5 | C8: 1 | D8: 1 | E8: 1 | F8: 1 | G8: 1 | L8: Target cell
A9: Tennessee | B9: =SUM(RC[1]:RC[5]) -> 5 | C9: 1 | D9: 1 | E9: 1 | F9: 1 | G9: 1
A10: Arizona | B10: =SUM(RC[1]:RC[5]) -> 5 | C10: 1 | D10: 1 | E10: 1 | F10: 1 | G10: 1 | L10: Changing cells
C11: --- | D11: --- | E11: --- | F11: --- | G11: ---
A12: Totals: | C12: =SUM(R[-4]C:R[-2]C) -> 3 | D12: =SUM(R[-4]C:R[-2]C) -> 3 | E12: =SUM(R[-4]C:R[-2]C) -> 3 | F12: =SUM(R[-4]C:R[-2]C) -> 3 | G12: =SUM(R[-4]C:R[-2]C) -> 3 | L12: Constraints
B14: Demands by Whse --> | C14: 180 | D14: 80 | E14: 200 | F14: 160 | G14: 220
A15: Plants: | B15: Supply | C15: Shipping costs from plant x to warehouse y (at intersection):
A16: S. Carolina | B16: 310 | C16: 10 | D16: 8 | E16: 6 | F16: 5 | G16: 4
A17: Tennessee | B17: 260 | C17: 6 | D17: 5 | E17: 4 | F17: 3 | G17: 6
A18: Arizona | B18: 280 | C18: 3 | D18: 4 | E18: 5 | F18: 5 | G18: 9
A20: Shipping: | B20: =SUM(RC[1]:RC[5]) -> 83 | C20: =R[-12]C*R[-4]C+R[-11]C*R[-3]C+R[-10]C*R[-2]C -> 19 | D20: =R[-12]C*R[-4]C+R[-11]C*R[-3]C+R[-10]C*R[-2]C -> 17 | E20: =R[-12]C*R[-4]C+R[-11]C*R[-3]C+R[-10]C*R[-2]C -> 15 | F20: =R[-12]C*R[-4]C+R[-11]C*R[-3]C+R[-10]C*R[-2]C -> 13 | G20: =R[-12]C*R[-4]C+R[-11]C*R[-3]C+R[-10]C*R[-2]C -> 19
A22: The problem presented in this model involves the shipment of goods from three plants to five regional
A23: warehouses. Goods can be shipped from any plant to any warehouse, but it obviously costs more to
A24: ship goods over long distances than over short distances. The problem is to determine the amounts
A25: to ship from each plant to each warehouse at minimum shipping cost in order to meet the regional
A26: demand, while not exceeding the plant supplies.
A28: Problem Specifications
A30: Target cell | C30: B20 | E30: Goal is to minimize total shipping cost.
A32: Changing cells | C32: C8:G10 | E32: Amount to ship from each plant to each
E33: warehouse.
A35: Constraints | C35: B8:B10<=B16:B18 | E35: Total shipped must be less than or equal to
E36: supply at plant.
C38: C12:G12>=C14:G14 | E38: Totals shipped to warehouses must be greater
E39: than or equal to demand at warehouses.
C41: C8:G10>=0 | E41: Number to ship must be greater than or equal
E42: to 0.
A44: You can solve this problem faster by selecting the Assume linear model check box in the Solver
A45: Options dialog box before clicking Solve. A problem of this type has an optimum solution at which
A46: amounts to ship are integers, if all of the supply and demand constraints are integers.

Sheet: Staff Scheduling
A1: Example 3: Personnel scheduling for an Amusement Park.
A2: For employees working five consecutive days with two days off, find the schedule that meets demand
A3: from attendance levels while minimizing payroll costs.
A6: Sch. | B6: Days off | D6: Employees | F6: Sun | G6: Mon | H6: Tue | I6: Wed | J6: Thu | K6: Fri | L6: Sat | N6: Color Coding
A7: A | B7: Sunday, Monday | D7: 4 | F7: 0 | G7: 0 | H7: 1 | I7: 1 | J7: 1 | K7: 1 | L7: 1
A8: B | B8: Monday, Tuesday | D8: 4 | F8: 1 | G8: 0 | H8: 0 | I8: 1 | J8: 1 | K8: 1 | L8: 1 | P8: Target cell
A9: C | B9: Tuesday, Wed. | D9: 4 | F9: 1 | G9: 1 | H9: 0 | I9: 0 | J9: 1 | K9: 1 | L9: 1
A10: D | B10: Wed., Thursday | D10: 6 | F10: 1 | G10: 1 | H10: 1 | I10: 0 | J10: 0 | K10: 1 | L10: 1 | P10: Changing cells
A11: E | B11: Thursday, Friday | D11: 6 | F11: 1 | G11: 1 | H11: 1 | I11: 1 | J11: 0 | K11: 0 | L11: 1
A12: F | B12: Friday, Saturday | D12: 4 | F12: 1 | G12: 1 | H12: 1 | I12: 1 | J12: 1 | K12: 0 | L12: 1 | P12: Constraints
A13: G | B13: Saturday, Sunday | D13: 4 | F13: 0 | G13: 1 | H13: 1 | I13: 1 | J13: 1 | K13: 1 | L13: 0
C15: Schedule Totals: | D15: =SUM(R[-8]C:R[-2]C) -> 32 | F15: =R7C4*R[-8]C+R8C4*R[-7]C+R9C4*R[-6]C+R10C4*R[-5]C+R11C4*R[-4]C+R12C4*R[-3]C+R13C4*R[-2]C -> 24 | G15: =R7C4*R[-8]C+R8C4*R[-7]C+R9C4*R[-6]C+R10C4*R[-5]C+R11C4*R[-4]C+R12C4*R[-3]C+R13C4*R[-2]C -> 24 | H15: =R7C4*R[-8]C+R8C4*R[-7]C+R9C4*R[-6]C+R10C4*R[-5]C+R11C4*R[-4]C+R12C4*R[-3]C+R13C4*R[-2]C -> 24 | I15: =R7C4*R[-8]C+R8C4*R[-7]C+R9C4*R[-6]C+R10C4*R[-5]C+R11C4*R[-4]C+R12C4*R[-3]C+R13C4*R[-2]C -> 22 | J15: =R7C4*R[-8]C+R8C4*R[-7]C+R9C4*R[-6]C+R10C4*R[-5]C+R11C4*R[-4]C+R12C4*R[-3]C+R13C4*R[-2]C -> 20 | K15: =R7C4*R[-8]C+R8C4*R[-7]C+R9C4*R[-6]C+R10C4*R[-5]C+R11C4*R[-4]C+R12C4*R[-3]C+R13C4*R[-2]C -> 22 | L15: =R7C4*R[-8]C+R8C4*R[-7]C+R9C4*R[-6]C+R10C4*R[-5]C+R11C4*R[-4]C+R12C4*R[-3]C+R13C4*R[-2]C -> 28
C17: Total Demand: | F17: 22 | G17: 17 | H17: 13 | I17: 14 | J17: 15 | K17: 18 | L17: 24
B19: Pay/Employee/Day: | D19: 40
B20: Payroll/Week: | D20: =R[-5]C*R[-1]C -> 1280
A22: The goal for this model is to schedule employees so that you have sufficient staff at the lowest cost. In
A23: this example, all employees are paid at the same rate, so by minimizing the number of employees working
A24: each day, you also minimize costs. Each employee works five consecutive days, followed by two days
A25: off.
A27: Problem Specifications
A29: Target cell | C29: D20 | E29: Goal is to minimize payroll cost.
A31: Changing cells | C31: D7:D13 | E31: Employees on each schedule.
A33: Constraints | C33: D7:D13>=0 | E33: Number of employees must be greater than or equal
E34: to 0.
C36: D7:D13=Integer | E36: Number of employees must be an integer.
C38: F15:L15>=F17:L17 | E38: Employees working each day must be greater than or
E39: equal to the demand.
A41: Possible schedules | C41: Rows 7-13 | E41: 1 means employee on that schedule works that day.
A43: In this example, you use an integer constraint so that your solutions do not result in fractional numbers of
A44: employees on each schedule. Selecting the Assume linear model check box in the Solver Options
A45: dialog box before you click Solve will greatly speed up the solution process.

Sheet: Maximizing Income
A1: Example 4: Working Capital Management.
A2: Determine how to invest excess cash in 1-month, 3-month and 6-month CDs so as to
A3: maximize interest income while meeting company cash requirements (plus safety margin).
B5: Yield | C5: Term | E5: Purchase CDs in months:
A6: 1-mo CDs: | B6: 0.01 | C6: 1 | E6: 1, 2, 3, 4, 5 and 6 | H6: Interest
A7: 3-mo CDs: | B7: 0.04 | C7: 3 | E7: 1 and 4 | H7: Earned:
A8: 6-mo CDs: | B8: 0.09 | C8: 6 | E8: 1 | G8: Total | H8: =SUM(R[5]C[-6]:R[5]C) -> 7700
A10: Month: | B10: Month 1 | C10: Month 2 | D10: Month 3 | E10: Month 4 | F10: Month 5 | G10: Month 6 | H10: End | J10: Color Coding
A11: Init Cash: | B11: 400000 | C11: =R[7]C[-1] -> 205000 | D11: =R[7]C[-1] -> 216000 | E11: =R[7]C[-1] -> 237000 | F11: =R[7]C[-1] -> 158400 | G11: =R[7]C[-1] -> 109400 | H11: =R[7]C[-1] -> 125400
A12: Matur CDs: | C12: =R[2]C[-1] -> 100000 | D12: =R[2]C[-1] -> 100000 | E12: =R[2]C[-1]+R[3]C[-3] -> 110000 | F12: =R[2]C[-1] -> 100000 | G12: =R[2]C[-1] -> 100000 | H12: =R[2]C[-1]+R[3]C[-3]+R[4]C[-6] -> 120000 | L12: Target cell
A13: Interest: | C13: =R[1]C[-1]*R6C2 -> 1000 | D13: =R[1]C[-1]*R6C2 -> 1000 | E13: =R[1]C[-1]*R6C2+R[2]C[-3]*R7C2 -> 1400 | F13: =R[1]C[-1]*R6C2 -> 1000 | G13: =R[1]C[-1]*R6C2 -> 1000 | H13: =R[1]C[-1]*R6C2+R[2]C[-3]*R7C2+R[3]C[-6]*R8C2 -> 2300
A14: 1-mo CDs: | B14: =100000 -> 100000 | C14: =100000 -> 100000 | D14: =100000 -> 100000 | E14: =100000 -> 100000 | F14: =100000 -> 100000 | G14: =100000 -> 100000 | L14: Changing cells
A15: 3-mo CDs: | B15: 10000 | E15: 10000
A16: 6-mo CDs: | B16: 10000 | L16: Constraints
A17: Cash Uses: | B17: 75000 | C17: -10000 | D17: -20000 | E17: 80000 | F17: 50000 | G17: -15000 | H17: 60000
A18: End Cash: | B18: =SUM(R[-7]C:R[-5]C)-SUM(R[-4]C:R[-1]C) -> 205000 | C18: =SUM(R[-7]C:R[-5]C)-SUM(R[-4]C:R[-1]C) -> 216000 | D18: =SUM(R[-7]C:R[-5]C)-SUM(R[-4]C:R[-1]C) -> 237000 | E18: =SUM(R[-7]C:R[-5]C)-SUM(R[-4]C:R[-1]C) -> 158400 | F18: =SUM(R[-7]C:R[-5]C)-SUM(R[-4]C:R[-1]C) -> 109400 | G18: =SUM(R[-7]C:R[-5]C)-SUM(R[-4]C:R[-1]C) -> 125400 | H18: =SUM(R[-7]C:R[-5]C)-SUM(R[-4]C:R[-1]C) -> 187700
B20: =1*R[-6]C+3*R[-5]C+6*R[-4]C-4*SUM(R[-6]C:R[-4]C) -> -290000
A22: If you're a financial officer or a manager, one of your tasks is to manage cash and short-term investments in a
A23: way that maximizes interest income, while keeping funds available to meet expenditures. You must trade off
A24: the higher interest rates available from longer-term investments against the flexibility provided by keeping funds
A25: in short-term investments.
A27: This model calculates ending cash based on initial cash (from the previous month), inflows from maturing
A28: certificates of deposit (CDs), outflows for new CDs, and cash needed for company operations for each month.
A30: You have a total of nine decisions to make: the amounts to invest in one-month CDs in months 1 through 6;
A31: the amounts to invest in three-month CDs in months 1 and 4; and the amount to invest in six-month CDs in
A32: month 1.
A34: Problem Specifications
A36: Target cell | C36: H8 | E36: Goal is to maximize interest earned.
A38: Changing cells | C38: B14:G14 | E38: Dollars invested in each type of CD.
C39: B15, E15, B16
A41: Constraints | C41: B14:G14>=0 | E41: Investment in each type of CD must be greater than
C42: B15:B16>=0 | E42: or equal to 0.
C43: E15>=0
C45: B18:H18>=100000 | E45: Ending cash must be greater than or equal to
E46: $100,000.
A48: The optimal solution determined by Solver earns a total interest income of $16,531 by investing as much as
A49: possible in six-month and three-month CDs, and then turns to one-month CDs. This solution satisfies all of the
A50: constraints.
A52: Suppose, however, that you want to guarantee that you have enough cash in month 5 for an equipment
A53: payment. Add a constraint that the average maturity of the investments held in month 1 should not be more
A54: than four months.
A56: The formula in cell B20 computes a total of the amounts invested in month 1 (B14, B15, and B16), weighted
A57: by the maturities (1, 3, and 6 months), and then it subtracts from this amount the total investment, weighted by
A58: 4. If this quantity is zero or less, the average maturity will not exceed four months. To add this constraint,
A59: restore the original values and then click Solver on the Tools menu. Click Add. Type b20 in the Cell
A60: Reference box, type 0 in the Constraint box, and then click OK. To solve the problem, click Solve.
A62: To satisfy the four-month maturity constraint, Solver shifts funds from six-month CDs to three-month CDs. The
A63: shifted funds now mature in month 4 and, according to the present plan, are reinvested in new three-month
A64: CDs. If you need the funds, however, you can keep the cash instead of reinvesting. The $56,896 turning
A65: over in month 4 is more than sufficient for the equipment payment in month 5. You've traded about $460 in
A66: interest income to gain this flexibility.

Sheet: Portfolio of Securities
A1: Example 5: Efficient stock portfolio.
A2: Find the weightings of stocks in an efficient portfolio that maximizes the portfolio rate of
A3: return for a given level of risk. This worksheet uses the Sharpe single-index model; you
A4: can also use the Markowitz method if you have covariance terms available.
A6: Risk-free rate | C6: 0.06 | E6: Market variance | G6: 0.03
A7: Market rate | C7: 0.15 | E7: Maximum weight | G7: 1
B9: Beta | C9: ResVar | E9: Weight | F9: *Beta | G9: *Var. | I9: Color Coding
A10: Stock A | B10: 0.8 | C10: 0.04 | E10: 0.2 | F10: =RC[-1]*RC[-4] -> 0.16000000000000003 | G10: =RC[-2]^2*RC[-4] -> 1.6000000000000003E-3
A11: Stock B | B11: 1 | C11: 0.2 | E11: 0.2 | F11: =RC[-1]*RC[-4] -> 0.2 | G11: =RC[-2]^2*RC[-4] -> 8.0000000000000019E-3 | K11: Target cell
A12: Stock C | B12: 1.8 | C12: 0.12 | E12: 0.2 | F12: =RC[-1]*RC[-4] -> 0.36000000000000004 | G12: =RC[-2]^2*RC[-4] -> 4.8000000000000004E-3
A13: Stock D | B13: 2.2 | C13: 0.4 | E13: 0.2 | F13: =RC[-1]*RC[-4] -> 0.44000000000000006 | G13: =RC[-2]^2*RC[-4] -> 1.6000000000000004E-2 | K13: Changing cells
A14: T-bills | B14: 0 | C14: 0 | E14: 0.2 | F14: =RC[-1]*RC[-4] -> 0 | G14: =RC[-2]^2*RC[-4] -> 0
K15: Constraints
A16: Total | E16: =SUM(R[-6]C:R[-2]C) -> 1 | F16: =SUM(R[-6]C:R[-2]C) -> 1.1600000000000001 | G16: =SUM(R[-6]C:R[-2]C) -> 3.0400000000000007E-2
E17: Return | G17: Variance
C18: Portfolio Totals: | E18: =R[-12]C[-2]+(R[-11]C[-2]-R[-12]C[-2])*R[-2]C[1] -> 0.1644 | G18: =R[-12]C*R[-2]C[-1]^2+R[-2]C -> 7.0768000000000011E-2
A20: Maximize Return: A21:A29 | D20: Minimize Risk: D21:D29
A21: =MAX(R18C5) -> 0.1644 | D21: =MIN(R18C7) -> 7.0768000000000011E-2
A22: =COUNT(R10C5:R14C5) -> 5 | D22: =COUNT(R10C5:R14C5) -> 5
A23: =R10C5>=0 -> 1 | D23: =R10C5>=0 -> 1
A24: =R11C5>=0 -> 1 | D24: =R11C5>=0 -> 1
A25: =R12C5>=0 -> 1 | D25: =R12C5>=0 -> 1
A26: =R13C5>=0 -> 1 | D26: =R13C5>=0 -> 1
A27: =R14C5>=0 -> 1 | D27: =R14C5>=0 -> 1
A28: =R16C5=1 -> 1 | D28: =R16C5=1 -> 1
A29: =R18C7<=0.071 -> 1 | D29: =R18C5>=0.164 -> 1
A31: One of the basic principles of investment management is diversification. By holding a portfolio of several
A32: stocks, for example, you can earn a rate of return that represents the average of the returns from the
A33: individual stocks, while reducing your risk that any one stock will perform poorly.
A35: Using this model, you can use Solver to find the allocation of funds to stocks that minimizes the portfolio
A36: risk for a given rate of return, or that maximizes the rate of return for a given level of risk.
A38: This worksheet contains figures for beta (market-related risk) and residual variance for four stocks. In
A39: addition, your portfolio includes investments in Treasury bills (T-bills), assumed to have a risk-free rate of
A40: return and a variance of zero. Initially equal amounts (20 percent of the portfolio) are invested in each
A41: security.
A43: Use Solver to try different allocations of funds to stocks and T-bills to either maximize the portfolio rate of
A44: return for a specified level of risk or minimize the risk for a given rate of return. With the initial allocation
A45: of 20 percent across the board, the portfolio return is 16.4 percent and the variance is 7.1 percent.
A47: Problem Specifications
A49: Target cell | D49: E18 | F49: Goal is to maximize portfolio return.
A51: Changing cells | D51: E10:E14 | F51: Weight of each stock.
A53: Constraints | D53: E10:E14>=0 | F53: Weights must be greater than or equal to 0.
D55: E16=1 | F55: Weights must equal 1.
D57: G18<=0.071 | F57: Variance must be less than or equal to 0.071.
A59: Beta for each stock | D59: B10:B13
A61: Variance for each stock | D61: C10:C13
A63: Cells D21:D29 contain the problem specifications to minimize risk for a required rate of return of 16.4
A64: percent. To load these problem specifications into Solver, click Solver on the Tools menu, click
A65: Options, click Load Model, select cells D21:D29 on the worksheet, and then click OK until the
A66: Solver Parameters dialog box is displayed. Click Solve. As you can see, Solver finds portfolio
A67: allocations in both cases that surpass the rule of 20 percent across the board.
A69: You can earn a higher rate of return (17.1 percent) for the same risk, or you can reduce your risk without
A70: giving up any return. These two allocations both represent efficient portfolios.
A72: Cells A21:A29 contain the original problem model. To reload this problem, click Solver on the Tools
A73: menu, click Options, click Load Model, select cells A21:A29 on the worksheet, and then click OK.
A75: Solver displays a message asking if you want to reset the current Solver option settings with the settings
A76: for the model you are loading. Click OK to proceed.

Sheet: Engineering Design
A1: Example 6: Value of a resistor in an electrical circuit.
A2: Find the value of a resistor in an electrical circuit that will dissipate the charge to 1
A3: percent of its original value within one-twentieth of a second after the switch is closed.
B5: Switch->
F6: q0 = | G6: 9 | H6: volts | J6: Color Coding
F7: q[t] = | G7: 0.09 | H7: volts
F8: t = | G8: 0.05 | H8: seconds | L8: Target cell
A9: Battery | B9: Capacitor (C) | D9: Inductor (L) | F9: L = | G9: 8 | H9: henrys
F10: C = | G10: 0.0001 | H10: farads | L10: Changing cells
C12: Resistor | F12: R = | G12: 300 | H12: ohms | L12: Constraints
C13: (R)
B15: 1/(L*C) | D15: =1/(L_*C_) -> 1250 | F15: q[t] = | G15: =R[5]C[-3]*R[3]C[-3] -> 0.2538891840303239
B16: (R/(2*L))^2 | D16: =(R_/(2*L_))^2 -> 351.5625
B17: SQRT(B15-B16) | D17: =SQRT(R[-2]C-R[-1]C) -> 29.973947020704497
B18: COS(T*B17) | D18: =COS(t_*R[-1]C) -> 7.2036527095114836E-2
B19: -R*T/(2*L) | D19: =-R_*t_/(2*L_) -> -0.9375
B20: Q0*EXP(B19) | D20: =q0*EXP(R[-1]C) -> 3.524450640091191
A22: This model depicts an electrical circuit containing a battery, switch, capacitor, resistor, and
A23: inductor. With the switch in the left position, the battery charges the capacitor. When the switch
A24: is thrown to the right, the capacitor discharges through the inductor and the resistor, both of
A25: which dissipate electrical energy.
A27: Using Kirchhoff's second law, you can formulate and solve a differential equation to determine
A28: how the charge on the capacitor varies over time. The formula relates the charge q[t] at time t
A29: to the inductance L, resistance R, and capacitance C of the circuit elements.
A31: Use Solver to pick an appropriate value for the resistor R (given values for the inductor L and
A32: the capacitor C) that will dissipate the charge to one percent of its initial value within
A33: one-twentieth of a second after the time the switch is thrown.
A35: Problem Specifications
A37: Target cell | C37: G15 | E37: Goal is to set to value of 0.09.
A39: Changing cell | C39: G12 | E39: Resistor.
A41: Constraints | C41: D15:D20 | E41: Algebraic solution to Kirchhoff's law.
A43: This problem and solution are appropriate for a narrow range of values; the function represented
A44: by the charge on the capacitor over time is actually a damped sine wave.